{
  "schema_version": "1.0.0",
  "generated_on": "2026-09-24",
  "dataset_name": "Kaung Thiha canonical career history",
  "purpose": [
    "Single source of truth for portfolio Work/Create sections",
    "Source data for future resume variants",
    "Preserve historical experience without letting stale resume wording override newer authoritative records"
  ],
  "usage_contract": {
    "authoritative_title_rule": "Use canonical_title and role dates in experience[].roles. Do not substitute title aliases unless explicitly generating a historical resume reproduction.",
    "current_source_rule": "src_apm_general wins when job titles, current role ordering, or current-facing education conflict with older files.",
    "achievement_rule": "Achievements supported only by supplemental sources are retained but marked website_default=false when they are too detailed, stale, or unnecessary for a minimal portfolio.",
    "conflict_rule": "Do not silently resolve unresolved conflicts. Use conflicts[] and data_quality_notes[] to decide whether to omit a disputed fact from public copy.",
    "privacy_rule": "Do not expose phone numbers or private/internal employer material. This dataset intentionally excludes the phone number present in source resumes.",
    "rendering_rule": "Website components should read from this dataset (or a typed derivative of it) instead of hard-coding job titles, dates, or metrics."
  },
  "profile": {
    "name": "Kaung Thiha",
    "location": "Arlington, VA",
    "public_links": {
      "linkedin": "https://www.linkedin.com/in/kaungthiha",
      "portfolio": "https://kaungthiha.github.io",
      "github": "https://github.com/kaungthiha"
    },
    "public_email": "kaungthiha.3@gmail.com",
    "source_ids": [
      "src_apm_general",
      "src_portfolio_site"
    ]
  },
  "education": [
    {
      "id": "edu_harvard_alm",
      "institution": "Harvard University",
      "credential": "Master of Liberal Arts (ALM) in Extension Studies",
      "field": "Data Science",
      "status": "in_progress",
      "start_date": null,
      "expected_completion": "2027",
      "website_default": true,
      "source_ids": [
        "src_apm_general"
      ],
      "confidence": "high"
    },
    {
      "id": "edu_usf_bs",
      "institution": "University of San Francisco",
      "credential": "Bachelor of Science (B.S.)",
      "field": "Business Analytics",
      "start_date": "2021-08",
      "end_date": "2024-05",
      "gpa": 3.81,
      "website_default": true,
      "source_ids": [
        "src_apm_general",
        "src_product_healthcare"
      ],
      "confidence": "high",
      "historical_variants": [
        {
          "description": "Older resumes described the degree as 'BSBA Business Analytics, Computer Science' or 'B.S. Business Analytics, Computer Science'.",
          "source_ids": [
            "src_v17",
            "src_master",
            "src_coop_da",
            "src_passport"
          ],
          "canonical_resolution": "Use the latest APM resume wording: B.S. in Business Analytics."
        },
        {
          "description": "Older resumes showed GPA 3.8; Product Healthcare showed 3.81.",
          "source_ids": [
            "src_v17",
            "src_master",
            "src_passport",
            "src_product_healthcare"
          ],
          "canonical_resolution": "Use 3.81 when GPA is needed; latest APM resume omits GPA entirely."
        }
      ]
    },
    {
      "id": "edu_coop_da",
      "institution": "COOP Careers",
      "credential": "Data Analytics Fellow",
      "field": "SQL, Python, Tableau, analytics and professional development",
      "start_date": "2024-08",
      "end_date": "2024-12",
      "duration_notes": "16-week fellowship; one source also describes approximately 200 hours of hands-on learning.",
      "website_default": false,
      "source_ids": [
        "src_product_healthcare",
        "src_coop_da"
      ],
      "confidence": "high"
    }
  ],
  "experience": [
    {
      "id": "exp_capital_one",
      "organization": "Capital One",
      "location": "McLean, VA",
      "website_priority": 1,
      "website_default": true,
      "roles": [
        {
          "id": "role_c1_emerging_payments",
          "canonical_title": "Associate Data Analyst",
          "team_or_scope": "Emerging Payments & Strategy",
          "start_date": "2026-09",
          "end_date": null,
          "current": true,
          "title_source_ids": [
            "src_apm_general"
          ],
          "title_aliases": [],
          "summary": "Owns consumer analytics for emerging-payment products and investment decisions across Capital One's Card portfolio.",
          "achievements": [
            {
              "id": "c1_ep_google_pay_paypal",
              "text": "Own consumer analytics for Google Pay and PayPal across Capital One's $53.9B Card portfolio, presenting insights to EVP+ audiences to shape enterprise product investment strategy.",
              "metrics": [
                {
                  "name": "card_portfolio_value",
                  "value": 53.9,
                  "unit": "USD billions"
                }
              ],
              "website_default": true,
              "public_safe": true,
              "source_ids": [
                "src_apm_general"
              ],
              "confidence": "high"
            },
            {
              "id": "c1_ep_alerts_pipeline",
              "text": "Launched an alerts monitoring pipeline covering approximately 16M events and a unified data cube spanning approximately $106M in recouped customer spend across 6 alert types.",
              "metrics": [
                {
                  "name": "events_covered",
                  "value": 16,
                  "unit": "millions",
                  "qualifier": "approximately"
                },
                {
                  "name": "recouped_customer_spend",
                  "value": 106,
                  "unit": "USD millions",
                  "qualifier": "approximately"
                },
                {
                  "name": "alert_types",
                  "value": 6,
                  "unit": "types"
                }
              ],
              "website_default": true,
              "public_safe": true,
              "source_ids": [
                "src_apm_general"
              ],
              "confidence": "high"
            }
          ]
        },
        {
          "id": "role_c1_data_products",
          "canonical_title": "Associate Data Product Manager",
          "team_or_scope": "Data Products & Experiences",
          "start_date": "2025-07",
          "end_date": "2026-09",
          "current": false,
          "title_source_ids": [
            "src_apm_general"
          ],
          "title_aliases": [
            {
              "title": "Associate Data Product Analyst",
              "source_ids": [
                "src_master"
              ],
              "status": "superseded_by_authoritative_source"
            }
          ],
          "summary": "Built analytics, automation, and discovery systems supporting data-product adoption and delivery.",
          "achievements": [
            {
              "id": "c1_dp_jira_automation",
              "text": "Automated Jira ticket processing with Python in Databricks, eliminating 5+ hours of weekly manual validation.",
              "metrics": [
                {
                  "name": "manual_time_saved",
                  "value": 5,
                  "unit": "hours/week",
                  "qualifier": "at least"
                }
              ],
              "website_default": true,
              "public_safe": true,
              "source_ids": [
                "src_apm_general",
                "src_master"
              ],
              "confidence": "high"
            },
            {
              "id": "c1_dp_discovery_framework",
              "text": "Wrote the PRD and built a discovery framework across Snowflake, OneLake, and APIs using SQL regex to classify reference data for an AI-agent data product, lifting data-product consumption 7%.",
              "metrics": [
                {
                  "name": "data_product_consumption_lift",
                  "value": 7,
                  "unit": "percent"
                }
              ],
              "website_default": true,
              "public_safe": true,
              "source_ids": [
                "src_apm_general",
                "src_master"
              ],
              "confidence": "high"
            },
            {
              "id": "c1_dp_data_model",
              "text": "Redesigned a Spark SQL data model handling 1.2TB of monthly event data, reducing script complexity 87% (1,500 to 200 lines) and Databricks cluster runtime 33% (6 to 4 hours).",
              "metrics": [
                {
                  "name": "monthly_event_data",
                  "value": 1.2,
                  "unit": "TB"
                },
                {
                  "name": "script_complexity_reduction",
                  "value": 87,
                  "unit": "percent"
                },
                {
                  "name": "script_lines_before",
                  "value": 1500,
                  "unit": "lines"
                },
                {
                  "name": "script_lines_after",
                  "value": 200,
                  "unit": "lines"
                },
                {
                  "name": "cluster_runtime_reduction",
                  "value": 33,
                  "unit": "percent"
                },
                {
                  "name": "cluster_runtime_before",
                  "value": 6,
                  "unit": "hours"
                },
                {
                  "name": "cluster_runtime_after",
                  "value": 4,
                  "unit": "hours"
                }
              ],